{"veritas_version":"0.1.0","question_id":"aurora-q002","graph_snapshot":"aurora-2026-07-12-sha1:e717347b","answerable":true,"golden_nodes":[],"golden_edges":[
{"source":"art:11","type":"IMPOSES","target":"obl:OBL-ART11-1","role":"required","required_provenance":"derived"},
{"source":"obl:OBL-ART11-1","type":"APPLIES_TO","target":"role:provider","role":"required","required_provenance":"derived"},
{"source":"art:11","type":"IMPOSES","target":"obl:OBL-ART11-2","role":"supporting","required_provenance":"derived"},
{"source":"obl:OBL-ART11-2","type":"APPLIES_TO","target":"role:provider","role":"supporting","required_provenance":"derived"}],
"required_claims":[],"forbidden_claims":[],"annotation":{"annotator":"M","annotated_at":"2026-07-12","protocol_version":"1.0","difficulty":"clear","notes":"Art 11 technical documentation"}}
