{"veritas_version":"0.1.0","question_id":"aurora-q011","graph_snapshot":"aurora-2026-07-12-sha1:e717347b","answerable":true,"golden_nodes":[],"golden_edges":[
{"source":"art:26","type":"IMPOSES","target":"obl:OBL-DEPLOYER-USE","role":"required","required_provenance":"derived"},
{"source":"obl:OBL-DEPLOYER-USE","type":"APPLIES_TO","target":"role:deployer","role":"required","required_provenance":"derived"},
{"source":"art:26","type":"IMPOSES","target":"obl:OBL-ART26-1","role":"supporting","required_provenance":"derived"},
{"source":"obl:OBL-ART26-1","type":"APPLIES_TO","target":"role:deployer","role":"supporting","required_provenance":"derived"},
{"source":"art:26","type":"IMPOSES","target":"obl:OBL-ART26-2","role":"supporting","required_provenance":"derived"},
{"source":"obl:OBL-ART26-2","type":"APPLIES_TO","target":"role:deployer","role":"supporting","required_provenance":"derived"},
{"source":"art:26","type":"IMPOSES","target":"obl:OBL-ART26-5","role":"supporting","required_provenance":"derived"},
{"source":"obl:OBL-ART26-5","type":"APPLIES_TO","target":"role:deployer","role":"supporting","required_provenance":"derived"},
{"source":"art:26","type":"IMPOSES","target":"obl:OBL-ART26-6","role":"supporting","required_provenance":"derived"},
{"source":"obl:OBL-ART26-6","type":"APPLIES_TO","target":"role:deployer","role":"supporting","required_provenance":"derived"}],
"required_claims":[],"forbidden_claims":[],"annotation":{"annotator":"M","annotated_at":"2026-07-12","protocol_version":"1.0","difficulty":"clear","notes":"Art 26 deployer, 5 of 12 (hotspot)"}}
