{
  "veritas_version": "0.1.0",
  "question_id": "aurora-q008",
  "graph_snapshot": "aurora-2026-07-12-sha1:e717347b",
  "answerable": false,
  "golden_nodes": [],
  "golden_edges": [],
  "required_claims": [],
  "forbidden_claims": [
    {
      "text": "The AI Act mandates a specific programming language",
      "reason": ""
    }
  ],
  "annotation": {
    "annotator": "M",
    "annotated_at": "2026-07-12",
    "protocol_version": "1.0",
    "difficulty": "clear",
    "notes": ""
  }
}