{"veritas_version":"0.1.0","question_id":"aurora-q005","graph_snapshot":"aurora-2026-07-12-sha1:e717347b","answerable":true,"golden_nodes":[],"golden_edges":[
{"source":"art:53","type":"IMPOSES","target":"obl:OBL-ART53-1a","role":"required","required_provenance":"derived"},
{"source":"obl:OBL-ART53-1a","type":"CONDITIONAL_ON","target":"risk:gpai","role":"required","required_provenance":"derived"},
{"source":"art:53","type":"IMPOSES","target":"obl:OBL-ART53-1b","role":"supporting","required_provenance":"derived"},
{"source":"obl:OBL-ART53-1b","type":"CONDITIONAL_ON","target":"risk:gpai","role":"supporting","required_provenance":"derived"},
{"source":"art:53","type":"IMPOSES","target":"obl:OBL-ART53-1d","role":"supporting","required_provenance":"derived"},
{"source":"obl:OBL-ART53-1d","type":"CONDITIONAL_ON","target":"risk:gpai","role":"supporting","required_provenance":"derived"}],
"required_claims":[],"forbidden_claims":[],"annotation":{"annotator":"M","annotated_at":"2026-07-12","protocol_version":"1.0","difficulty":"clear","notes":"Art 53 GPAI transparency, 3 of 8"}}
