{
  "veritas_version": "0.1.0",
  "question_id": "matgraph-q019",
  "graph_snapshot": "mp-2026-06-30-sha1:4be2f1",
  "answerable": true,
  "golden_nodes": [],
  "golden_edges": [],
  "required_claims": [],
  "forbidden_claims": [],
  "annotation": {
    "annotator": "TODO",
    "annotated_at": "TODO",
    "protocol_version": "1.0",
    "_difficulty_hint": "set to 'clear' or 'borderline' when annotating",
    "notes": "HYPOTHESIS answerable=True. Answerable but nuanced: graph tags GaN transistor_channel, not power_electronics. Real-world yes, graph no — annotate to the graph."
  }
}